[
  {
    "id": "charisma",
    "name": "Charisma",
    "description": "Allies within 2 tiles gain +10 Hit, +5 Avoid",
    "trigger": "passive-aura",
    "range": 2,
    "effects": {
      "hitBonus": 10,
      "avoidBonus": 5
    },
    "personal": true
  },
  {
    "id": "foresight",
    "name": "Foresight",
    "description": "+1 range on Tome attacks",
    "trigger": "passive",
    "effects": {
      "tomeRangeBonus": 1
    },
    "personal": true
  },
  {
    "id": "resolve",
    "name": "Resolve",
    "description": "+4 STR/DEF when below 50% HP",
    "trigger": "on-combat-start",
    "condition": "below50",
    "effects": {
      "strBonus": 4,
      "defBonus": 4
    },
    "personal": true
  },
  {
    "id": "renewal_aura",
    "name": "Renewal Aura",
    "description": "Adjacent allies heal 3 HP at start of turn",
    "trigger": "on-turn-start",
    "range": 1,
    "effects": {
      "healAllies": 3
    },
    "personal": true
  },
  {
    "id": "sol",
    "name": "Sol",
    "description": "SKL/2% chance to heal damage dealt on hit",
    "trigger": "on-attack",
    "activation": "SKL_HALF"
  },
  {
    "id": "luna",
    "name": "Luna",
    "description": "SKL% chance on hit to halve the target’s DEF or RES (rounded down). Terrain protection remains.",
    "trigger": "on-attack",
    "activation": "SKL"
  },
  {
    "id": "astra",
    "name": "Astra",
    "description": "SKL/2% chance to strike 5 times at half damage",
    "trigger": "on-attack",
    "activation": "SKL_HALF"
  },
  {
    "id": "vantage",
    "name": "Vantage",
    "description": "Attack first when defending below 50% HP",
    "trigger": "on-combat-start",
    "condition": "below50"
  },
  {
    "id": "wrath",
    "name": "Wrath",
    "description": "+30 Crit when below 50% HP",
    "trigger": "on-combat-start",
    "condition": "below50",
    "effects": {
      "critBonus": 30
    }
  },
  {
    "id": "crit_plus_15",
    "name": "Critical +15",
    "description": "+15 critical hit rate",
    "trigger": "passive",
    "effects": {
      "critBonus": 15
    },
    "classInnate": "Swordmaster"
  },
  {
    "id": "sure_shot",
    "name": "Sure Shot",
    "description": "Ignore enemy terrain avoid bonus, +10 Crit",
    "trigger": "passive",
    "effects": {
      "ignoreTerrainAvoid": true,
      "critBonus": 10
    },
    "classInnate": "Sniper"
  },
  {
    "id": "lethality",
    "name": "Lethality",
    "description": "LCK/3% chance to instantly defeat enemy on hit",
    "trigger": "on-attack",
    "activation": "LCK_THIRD",
    "classInnate": "Assassin"
  },
  {
    "id": "pavise",
    "name": "Pavise",
    "description": "SKL% chance to halve physical damage taken",
    "trigger": "on-defend",
    "activation": "SKL",
    "classInnate": "General"
  },
  {
    "id": "aegis",
    "name": "Aegis",
    "description": "SKL% chance to halve magical damage taken",
    "trigger": "on-defend",
    "activation": "SKL",
    "classInnate": "Paladin"
  },
  {
    "id": "colossus",
    "name": "Colossus",
    "description": "+3 damage on all attacks",
    "trigger": "passive",
    "effects": {
      "atkBonus": 3
    },
    "classInnate": "Warrior"
  },
  {
    "id": "discipline",
    "name": "Discipline",
    "description": "+10 Hit, +5 Avoid",
    "trigger": "passive",
    "effects": {
      "hitBonus": 10,
      "avoidBonus": 5
    },
    "classInnate": "Falcon Knight"
  },
  {
    "id": "renewal",
    "name": "Renewal",
    "description": "Recover 10% max HP at start of turn",
    "trigger": "on-turn-start",
    "effects": {
      "healSelf": 10
    },
    "classInnate": "Bishop"
  },
  {
    "id": "vigilance",
    "name": "Vigilance",
    "description": "+15 Avoid",
    "trigger": "passive",
    "effects": {
      "avoidBonus": 15
    },
    "classInnate": "Hero"
  },
  {
    "id": "spell_harmony",
    "name": "Spell Harmony",
    "description": "If unit initiates combat, +2 Atk per adjacent allied player unit",
    "trigger": "on-combat-start",
    "condition": "initiating",
    "classInnate": "Sage"
  },
  {
    "id": "adept",
    "name": "Adept",
    "description": "SPD% chance for an extra follow-up strike at full damage (once per combat)",
    "trigger": "on-attack",
    "activation": "SPD"
  },
  {
    "id": "miracle",
    "name": "Miracle",
    "description": "LCK% chance to survive a lethal hit with 1 HP (once per battle)",
    "trigger": "on-defend",
    "activation": "LCK"
  },
  {
    "id": "guard",
    "name": "Guard",
    "description": "+3 DEF/RES when adjacent to an ally",
    "trigger": "on-combat-start",
    "condition": "adjacent_ally",
    "effects": {
      "defBonus": 3,
      "resBonus": 3
    }
  },
  {
    "id": "cancel",
    "name": "Cancel",
    "description": "SPD% chance to negate enemy's follow-up attack",
    "trigger": "on-defend",
    "activation": "SPD"
  },
  {
    "id": "desperation",
    "name": "Desperation",
    "description": "Below 50% HP: follow-up attacks land before enemy can counter",
    "trigger": "on-combat-start",
    "condition": "below50"
  },
  {
    "id": "quick_riposte",
    "name": "Quick Riposte",
    "description": "Above 50% HP: always double when defending",
    "trigger": "on-combat-start",
    "condition": "above50_defending"
  },
  {
    "id": "death_blow",
    "name": "Death Blow",
    "description": "+6 ATK when initiating combat",
    "trigger": "on-combat-start",
    "condition": "initiating",
    "effects": {
      "atkBonus": 6
    }
  },
  {
    "id": "darting_blow",
    "name": "Darting Blow",
    "description": "+6 SPD when initiating combat",
    "trigger": "on-combat-start",
    "condition": "initiating",
    "effects": {
      "spdBonus": 6
    },
    "classInnate": "Trickster"
  },
  {
    "id": "shove",
    "name": "Shove",
    "description": "Push an adjacent ally 1 tile away",
    "trigger": "action"
  },
  {
    "id": "pull",
    "name": "Pull",
    "description": "Pull an adjacent ally 1 tile toward you while stepping back",
    "trigger": "action"
  },
  {
    "id": "dance",
    "name": "Dance",
    "description": "Grant another ally another action this turn",
    "trigger": "action",
    "classInnate": "Dancer"
  },
  {
    "id": "blink",
    "name": "Blink",
    "description": "Once per battle: teleport to an open tile within 4 spaces",
    "trigger": "action",
    "actionAbility": {
      "kind": "teleport_self",
      "range": 4,
      "perMapLimit": 1
    }
  },
  {
    "id": "rally_cry_skill",
    "name": "Rally Cry",
    "description": "Once per battle: allies within 2 tiles gain +2 STR and +2 SPD for 2 phases",
    "trigger": "action",
    "actionAbility": {
      "kind": "ally_buff",
      "radius": 2,
      "stats": {
        "STR": 2,
        "SPD": 2
      },
      "durationPhases": 2,
      "perMapLimit": 1
    }
  },
  {
    "id": "healing_circle",
    "name": "Healing Circle",
    "description": "Once per battle: restore 15 HP to self and allies within 2 tiles",
    "trigger": "action",
    "actionAbility": {
      "kind": "aoe_heal",
      "radius": 2,
      "amount": 15,
      "includeSelf": true,
      "perMapLimit": 1
    }
  },
  {
    "id": "ensnare",
    "name": "Ensnare",
    "description": "Once per battle: root enemies within 2 tiles for 1 phase (may act, not move)",
    "trigger": "action",
    "actionAbility": {
      "kind": "aoe_root",
      "radius": 2,
      "durationPhases": 1,
      "perMapLimit": 1
    }
  },
  {
    "id": "smite",
    "name": "Smite",
    "description": "Push an adjacent enemy 2 tiles away",
    "trigger": "action",
    "actionAbility": {
      "kind": "push_enemy",
      "distance": 2,
      "usableWhileSilenced": true
    }
  },
  {
    "id": "transfuse",
    "name": "Transfuse",
    "description": "Give up to 10 HP to an adjacent ally",
    "trigger": "action",
    "actionAbility": {
      "kind": "transfer_hp",
      "amount": 10,
      "usableWhileSilenced": true
    }
  },
  {
    "id": "great_sacrifice",
    "name": "Great Sacrifice",
    "description": "Once per battle: pay up to 10 HP (never your last); allies within 2 tiles heal that much",
    "trigger": "action",
    "actionAbility": {
      "kind": "sacrifice_heal",
      "radius": 2,
      "amount": 10,
      "perMapLimit": 1
    }
  },
  {
    "id": "goddess_dance",
    "name": "Goddess Dance",
    "description": "Once per battle: every adjacent ally who has acted can act again",
    "trigger": "action",
    "actionAbility": {
      "kind": "refresh_adjacent",
      "perMapLimit": 1,
      "usableWhileSilenced": true
    }
  },
  {
    "id": "blink_strike",
    "name": "Blink Strike",
    "description": "Once per battle: warp next to a foe within 4 spaces and attack it",
    "trigger": "action",
    "actionAbility": {
      "kind": "warp_strike",
      "range": 4,
      "perMapLimit": 1
    }
  },
  {
    "id": "pass",
    "name": "Pass",
    "description": "Move through enemy units (but never stop on one)",
    "trigger": "passive",
    "classInnate": "Trickster"
  },
  {
    "id": "canto",
    "name": "Canto",
    "description": "Use remaining movement after acting",
    "trigger": "passive",
    "classInnate": [
      "Paladin",
      "Falcon Knight",
      "Holy Knight",
      "Seraph Knight",
      "Great Knight"
    ],
    "cantoRule": "any"
  },
  {
    "id": "commanders_gambit",
    "name": "Commander's Gambit",
    "description": "SKL/2%: Edric + allies within 1 tile act again this turn",
    "trigger": "on-attack",
    "activation": "SKL_HALF",
    "personal": true
  },
  {
    "id": "tactical_advantage",
    "name": "Tactical Advantage",
    "description": "Adjacent allies gain +3 to all stats",
    "trigger": "passive-aura",
    "range": 1,
    "effects": {
      "atkBonus": 3,
      "defBonus": 3,
      "resBonus": 3,
      "hitBonus": 6,
      "avoidBonus": 6,
      "critBonus": 1
    },
    "personal": true
  },
  {
    "id": "draconic_aura",
    "name": "Draconic Aura",